<?xml version="1.0" encoding="UTF-8"?>
<!-- Auto-generated by ezPolicy        -->
<SecurityPolicyDefinition xmlns="http://www.ibm.com" xmlns:xsi="http://www.w3.org/2001/XMLSchema-instance" xsi:schemaLocation="http://www.ibm.com ../../security_policy.xsd ">
    <PolicyHeader>
        <PolicyName>xm-test</PolicyName>
        <Date>Fri Sep 29 14:44:38 2006</Date>
        <Version>1.1</Version>
        <FromPolicy>
            <PolicyName>xm-test</PolicyName>
            <Version>1.0</Version>
        </FromPolicy>
    </PolicyHeader>

    <SimpleTypeEnforcement>
        <SimpleTypeEnforcementTypes>
            <Type>SystemManagement</Type>
            <Type>green</Type>
            <Type>red</Type>
        </SimpleTypeEnforcementTypes>
    </SimpleTypeEnforcement>

    <ChineseWall priority="PrimaryPolicyComponent">
        <ChineseWallTypes>
            <Type>SystemManagement</Type>
            <Type>green</Type>
            <Type>red</Type>
        </ChineseWallTypes>

        <ConflictSets>
            <Conflict name="RER">
                <Type>green</Type>
                <Type>red</Type>
            </Conflict>
       </ConflictSets>
    </ChineseWall>

    <SecurityLabelTemplate>
        <SubjectLabels bootstrap="SystemManagement">
            <VirtualMachineLabel>
                <Name>SystemManagement</Name>
                <SimpleTypeEnforcementTypes>
                    <Type>SystemManagement</Type>
                    <Type>green</Type>
                    <Type>red</Type>
                </SimpleTypeEnforcementTypes>
                <ChineseWallTypes>
                    <Type>SystemManagement</Type>
                </ChineseWallTypes>
            </VirtualMachineLabel>

            <VirtualMachineLabel>
                <Name>green</Name>
                <SimpleTypeEnforcementTypes>
                    <Type>green</Type>
                </SimpleTypeEnforcementTypes>
                <ChineseWallTypes>
                    <Type>green</Type>
                </ChineseWallTypes>
            </VirtualMachineLabel>

            <VirtualMachineLabel>
                <Name>red</Name>
                <SimpleTypeEnforcementTypes>
                    <Type>red</Type>
                </SimpleTypeEnforcementTypes>
                <ChineseWallTypes>
                    <Type>red</Type>
                </ChineseWallTypes>
            </VirtualMachineLabel>

        </SubjectLabels>

        <ObjectLabels>
            <ResourceLabel>
                <Name>SystemManagement</Name>
                <SimpleTypeEnforcementTypes>
                    <Type>SystemManagement</Type>
                </SimpleTypeEnforcementTypes>
            </ResourceLabel>

            <ResourceLabel>
                <Name>green</Name>
                <SimpleTypeEnforcementTypes>
                    <Type>green</Type>
                </SimpleTypeEnforcementTypes>
            </ResourceLabel>

            <ResourceLabel>
                <Name>red</Name>
                <SimpleTypeEnforcementTypes>
                    <Type>red</Type>
                </SimpleTypeEnforcementTypes>
            </ResourceLabel>

        </ObjectLabels>
    </SecurityLabelTemplate>
</SecurityPolicyDefinition>
